{
  "proposalBatchId": "55555555-5555-4555-8555-555555555555",
  "commandId": "11111111-1111-4111-8111-111111111111",
  "roomId": "22222222-2222-4222-8222-222222222222",
  "deviceId": "33333333-3333-4333-8333-333333333333",
  "schemaVersion": 1,
  "createdAt": "2026-07-11T09:00:05Z",
  "status": "ready",
  "proposals": [
    {
      "proposalId": "move:0123456789abcdef",
      "action": "move",
      "from": "inbox/note.md",
      "to": "documents/note.md",
      "sourceSizeBytes": 1024,
      "sourceModifiedUnixMs": 1783760400000,
      "reason": "rule 'documents' moves markdown files into documents/",
      "status": "ready"
    },
    {
      "proposalId": "move:fedcba9876543210",
      "action": "move",
      "from": "inbox/photo.png",
      "to": "images/photo.png",
      "sourceSizeBytes": 2048,
      "sourceModifiedUnixMs": 1783760400000,
      "reason": "rule 'images' moves this into images/",
      "status": "destination_exists"
    },
    {
      "proposalId": "trash:aaaaaaaaaaaaaaaa",
      "action": "trash",
      "from": "inbox/noise.tmp",
      "to": ".mousekeeper_trash",
      "sourceSizeBytes": 128,
      "sourceModifiedUnixMs": 1783760400000,
      "reason": "rule 'old-temp' moves this into recoverable trash",
      "status": "ready"
    }
  ]
}
